{
  "schema_version": "obd2.sim_scenario.v1",
  "scenario_id": "headers_off_echo_on",
  "synthetic": true,
  "description": "Clone-adapter behavior: every command is echoed even after ATE0, headers stay off despite ATH1, and the VIN arrives in the ELM formatted multi-line style. The scan must still complete cleanly.",
  "adapter_profile": "elm327_like_tcp",
  "defaults": {
    "at_response": "OK\r\r>",
    "obd_response": "NO DATA\r\r>"
  },
  "stream_split_bytes": null,
  "warnings": [
    "echo stays on for every command on purpose",
    "responses carry no ECU headers on purpose"
  ],
  "commands": [
    { "request": "ATZ", "response_chunks": ["ELM327 v1.5\r\r>"], "delay_ms": 5, "echo": true },
    { "request": "ATE0", "response_chunks": ["OK\r\r>"], "delay_ms": 3, "echo": true },
    { "request": "ATL0", "response_chunks": ["OK\r\r>"], "delay_ms": 3, "echo": true },
    { "request": "ATH1", "response_chunks": ["OK\r\r>"], "delay_ms": 3, "echo": true },
    { "request": "ATSP0", "response_chunks": ["OK\r\r>"], "delay_ms": 3, "echo": true },
    { "request": "0100", "response_chunks": ["SEARCHING...\r41 00 BE 3E B8 11\r\r>"], "delay_ms": 10, "echo": true },
    { "request": "0120", "response_chunks": ["41 20 80 00 00 00\r\r>"], "delay_ms": 5, "echo": true },
    { "request": "0101", "response_chunks": ["41 01 00 07 E5 00\r\r>"], "delay_ms": 5, "echo": true },
    { "request": "03", "response_chunks": ["43 00\r\r>"], "delay_ms": 5, "echo": true },
    { "request": "07", "response_chunks": ["47 00\r\r>"], "delay_ms": 5, "echo": true },
    { "request": "0A", "response_chunks": ["4A 00\r\r>"], "delay_ms": 5, "echo": true },
    { "request": "0902", "response_chunks": ["014\r0: 49 02 01 31 43 34\r1: 52 4A 46 42 47 38 46\r2: 43 31 32 33 34 35 36\r\r>"], "delay_ms": 8, "echo": true },
    { "request": "010C", "response_chunks": ["41 0C 1A F8\r\r>"], "delay_ms": 4, "echo": true },
    { "request": "0105", "response_chunks": ["41 05 7B\r\r>"], "delay_ms": 4, "echo": true },
    { "request": "010D", "response_chunks": ["41 0D 00\r\r>"], "delay_ms": 4, "echo": true },
    { "request": "0104", "response_chunks": ["41 04 3F\r\r>"], "delay_ms": 4, "echo": true },
    { "request": "0111", "response_chunks": ["41 11 21\r\r>"], "delay_ms": 4, "echo": true },
    { "request": "010F", "response_chunks": ["41 0F 37\r\r>"], "delay_ms": 4, "echo": true }
  ],
  "expected_scan_summary": {
    "stored_codes": [],
    "pending_codes": [],
    "permanent_codes": [],
    "mil_reported_on": false,
    "vin_reported": true,
    "live_value_count": 6,
    "no_stored_codes_observation": true
  }
}
