{
  "schema_version": "obd2.sim_scenario.v1",
  "scenario_id": "chunked_stream",
  "synthetic": true,
  "description": "Clean full scan delivered in 7-byte stream pieces to model BLE-style notification sizes and harsh TCP segmentation. Same expected outcome as no_codes_basic.",
  "adapter_profile": "elm327_like_tcp",
  "defaults": {
    "at_response": "OK\r\r>",
    "obd_response": "NO DATA\r\r>"
  },
  "stream_split_bytes": 7,
  "warnings": [],
  "commands": [
    { "request": "ATZ", "response_chunks": ["ELM327 v1.5\r\r>"], "delay_ms": 5, "echo": true },
    { "request": "ATE0", "response_chunks": ["OK\r\r>"], "delay_ms": 3, "echo": true },
    { "request": "ATL0", "response_chunks": ["OK\r\r>"], "delay_ms": 3, "echo": false },
    { "request": "ATH1", "response_chunks": ["OK\r\r>"], "delay_ms": 3, "echo": false },
    { "request": "ATSP0", "response_chunks": ["OK\r\r>"], "delay_ms": 3, "echo": false },
    { "request": "0100", "response_chunks": ["SEARCHING...\r7E8 06 41 00 BE 3E B8 11\r\r>"], "delay_ms": 10, "echo": false },
    { "request": "0120", "response_chunks": ["7E8 06 41 20 80 00 00 00\r\r>"], "delay_ms": 5, "echo": false },
    { "request": "0101", "response_chunks": ["7E8 06 41 01 00 07 E5 00\r\r>"], "delay_ms": 5, "echo": false },
    { "request": "03", "response_chunks": ["7E8 02 43 00\r\r>"], "delay_ms": 5, "echo": false },
    { "request": "07", "response_chunks": ["7E8 02 47 00\r\r>"], "delay_ms": 5, "echo": false },
    { "request": "0A", "response_chunks": ["7E8 02 4A 00\r\r>"], "delay_ms": 5, "echo": false },
    { "request": "0902", "response_chunks": ["7E8 10 14 49 02 01 31 43 34\r7E8 21 52 4A 46 42 47 38 46\r7E8 22 43 31 32 33 34 35 36\r\r>"], "delay_ms": 8, "echo": false },
    { "request": "010C", "response_chunks": ["7E8 04 41 0C 1A F8\r\r>"], "delay_ms": 4, "echo": false },
    { "request": "0105", "response_chunks": ["7E8 03 41 05 7B\r\r>"], "delay_ms": 4, "echo": false },
    { "request": "010D", "response_chunks": ["7E8 03 41 0D 00\r\r>"], "delay_ms": 4, "echo": false },
    { "request": "0104", "response_chunks": ["7E8 03 41 04 3F\r\r>"], "delay_ms": 4, "echo": false },
    { "request": "0111", "response_chunks": ["7E8 03 41 11 21\r\r>"], "delay_ms": 4, "echo": false },
    { "request": "010F", "response_chunks": ["7E8 03 41 0F 37\r\r>"], "delay_ms": 4, "echo": false }
  ],
  "expected_scan_summary": {
    "stored_codes": [],
    "pending_codes": [],
    "permanent_codes": [],
    "mil_reported_on": false,
    "vin_reported": true,
    "live_value_count": 6,
    "no_stored_codes_observation": true
  }
}
